{
  "$schema": "https://json-schema.org/draft/2020-12/schema",
  "$id": "https://github.com/Carrot123343r3f/literature-library-eval-skill/blob/main/schemas/run-config-schema.json",
  "title": "Run Configuration for Literature Library Evaluation",
  "description": "Single source of truth for every evaluation run. Generated by AI during intake; consumed by all downstream scripts.",
  "type": "object",
  "additionalProperties": false,
  "required": ["schema_version", "project", "library", "automation", "output"],
  "properties": {
    "schema_version": {"type": "string", "const": "1.0"},
    "project": {
      "type": "object",
      "additionalProperties": false,
      "required": ["research_question", "review_type", "scope_status"],
      "properties": {
        "research_question": {"type": "string", "minLength": 1},
        "review_type": {"type": "string", "enum": ["narrative", "systematic", "scoping", "rapid", "umbrella", "叙事综述", "系统综述", "范围综述", "快速综述", "伞式综述"]},
        "engineering_profile": {"type": "array", "items": {"type": "string"}},
        "scope_status": {"type": "string", "enum": ["in_scope", "cross_domain", "out_of_scope", "scope_uncertain"]},
        "scope_rationale": {"type": "string"},
        "time_range": {
          "type": "object",
          "additionalProperties": false,
          "properties": {
            "start": {"type": ["integer", "null"]},
            "end": {"type": ["integer", "null"]}
          }
        },
        "languages": {"type": "array", "items": {"type": "string"}, "default": ["en"]},
        "allowed_assessment_level": {"type": "string", "enum": ["full", "limited_metadata_only", "stop"]}
      }
    },
    "library": {
      "type": "object",
      "additionalProperties": false,
      "required": ["provided"],
      "properties": {
        "provided": {"type": "boolean"},
        "path": {"type": ["string", "null"], "description": "Path to library file. Relative paths are resolved against the directory containing run-config.json."},
        "format": {"type": ["string", "null"], "enum": ["json", "csv", "ris", "bibtex", null], "description": "Non-JSON formats are normalized to canonical JSON by scripts/import_library.py before auditing."},
        "record_count": {"type": ["integer", "null"]},
        "normalization_required": {"type": "boolean", "default": true}
      }
    },
    "automation": {
      "type": "object",
      "additionalProperties": false,
      "description": "Online access is opt-in during intake. Metadata enrichment, candidate discovery, and citation tracking require separate explicit permissions.",
      "required": ["allow_search"],
      "properties": {
        "allow_search": {"type": "boolean", "default": false, "description": "Enable only explicitly authorized online operations."},
        "allow_metadata_enrichment": {"type": "boolean", "default": false},
        "allow_external_discovery": {"type": "boolean", "default": false},
        "allow_citation_tracking": {"type": "boolean", "default": false},
        "local_only_confirmed": {"type": "boolean", "default": false, "description": "True only after the user explicitly chose fully local execution."},
        "allow_query_refinement": {"type": "boolean", "default": false},
        "allowed_sources": {"type": "array", "items": {"enum": ["openalex", "crossref", "arxiv", "europepmc"]}, "default": []},
        "authorized_sources": {"type": "array", "items": {"type": "string"}, "description": "Names of sources for which the user has authorized a preconfigured connector/session; never store passwords or tokens here."},
        "stop_conditions": {"type": "array", "items": {"type": "string"}}
      }
    },
    "evidence_inputs": {
      "type": "object",
      "additionalProperties": false,
      "properties": {
        "benchmark": {"type": ["string", "null"], "description": "A1 baseline file path. Produced by: manual/agent. Supports: A1."},
        "gold": {"type": ["string", "null"], "description": "A2 gold set file path. Produced by: manual/agent. Supports: A2."},
        "query_log": {"type": ["string", "null"], "description": "Run-log file. Produced by: user or search_for_eval.py. Supports: F1. Missing → F1 not_assessable."},
        "query_hits": {"type": ["string", "null"], "description": "query-hits.json from search_for_eval.py. Produced by: search_for_eval.py. Supports: A2. Missing → A2 not_assessable."},
        "query_plan": {"type": ["string", "null"], "description": "query-plan.json. Produced by: manual/agent. Supports: F1 traceability."},
        "source_snapshot": {"type": ["string", "null"], "description": "Collector snapshot for A3. Produced by: collect_open_sources.py. Supports: A3. Missing → A3 not_assessable."},
        "screening_decisions": {"type": ["string", "null"], "description": "Screening decisions for B/F5. Produced by: manual/agent. Supports: B GGR/DRR, F5 traceability. Missing → B discovery_only, F5 provenance-only."},
        "deduplication_log": {"type": ["string", "null"], "description": "Dedup/version log. Produced by: normalize_candidates.py. Supports: F4. Missing → F4 not_assessable (version candidates)."},
        "search_meta": {"type": ["string", "null"], "description": "search_meta.json from search_for_eval.py. Produced by: search_for_eval.py. Supports: A2 sensitivity, B discovery candidates."},
        "screening_summary": {"type": ["string", "null"], "description": "screening-summary.json from summarize_screening.py. Supports B/F screening evidence only; never substitutes for search_meta."},
        "search_iterations": {"type": ["string", "null"], "description": "iterations.json with dev_set, tuning validation_set, and heldout_test_set. A2 measured requires heldout_test_set to match gold by stable IDs."},
        "failed_sources": {"type": "array", "items": {"type": "string"}, "description": "Names of sources that failed during collection. Produced by: all collectors. Supports: A2/A3 partial_snapshot downgrade."}
      }
    },
    "standards": {
      "type": "object",
      "additionalProperties": false,
      "properties": {
        "defaults_profile": {"type": "string", "description": "Which profile generated the defaults"},
        "user_overrides": {"type": "object", "description": "User-provided threshold overrides"},
        "confirmed_by_user": {"type": "boolean", "default": false}
      }
    },
    "output": {
      "type": "object",
      "additionalProperties": false,
      "description": "v1.0: human-readable output is HTML and machine-readable output is JSON. Markdown is not a supported persisted report format.",
      "properties": {
        "language": {"type": "string", "default": "zh-CN", "description": "Sets the HTML language tag and localized evidence-gap messages. Full report translation is not currently supported; the report body remains Chinese."},
        "formats": {"type": "array", "items": {"enum": ["html", "json"]}, "minItems": 1, "default": ["html", "json"]},
        "include_standards_appendix": {"type": "boolean", "default": true}
      }
    },
    "paper_evaluation": {
      "type": "object",
      "additionalProperties": false,
      "description": "Optional V2 single-paper evidence evaluation settings.",
      "properties": {
        "enabled": {"type": "boolean", "default": false},
        "scope": {
          "type": "object",
          "additionalProperties": false,
          "properties": {
            "object": {"type": "array", "items": {"type": "string"}},
            "technology": {"type": "array", "items": {"type": "string"}},
            "performance": {"type": "array", "items": {"type": "string"}},
            "context": {"type": "array", "items": {"type": "string"}}
          }
        }
      }
    },
    "optimization": {
      "type": "object",
      "additionalProperties": false,
      "description": "Optional SkillHone-style optimization workspace. When present, run_full_audit.py validates it before producing the audit.",
      "properties": {
        "enabled": {"type": "boolean", "default": false},
        "run_root": {"type": ["string", "null"], "description": "Path to a separate optimization Run Workspace; Skill Repo and Eval Repo are recorded in its workspace-manifest.json."},
        "require_contract_gate": {"type": "boolean", "default": true}
      }
    },
    "quality": {
      "type": "object",
      "additionalProperties": false,
      "description": "Optional quality-maintenance helpers; these do not change A–F decisions automatically.",
      "properties": {
        "active_screen_budget": {"type": ["integer", "null"], "minimum": 1, "description": "Generate a prioritized human-review queue after candidate normalization."}
      }
    },
    "generated_by": {"type": "string", "description": "Agent name or session ID"},
    "generated_at": {"type": "string", "format": "date-time"}
  }
}
